{"run":70,"commit":"364bdee","metric":8.58,"metrics":{"coverage_branches":92.2,"coverage_funcs":98.31,"coverage_lines":98.97,"coverage_stmts":98.05,"file_count":211,"test_count":3659,"ut_max_s":11.62,"ut_min_s":4.55,"ut_stddev_s":2.896},"status":"discard","description":"Final validation under load 8 — min 4.55s; load-noise dominates","timestamp":1776725407258,"segment":4,"confidence":1.3103448275862064,"iterationTokens":3156,"asi":{"hypothesis":"Final validation — confirm baseline holds with __tests__ exclusion","load_avg":"8.22 (still elevated, background work present)","min_s_under_load":4.55,"next_action_hint":"Session conclusion: 3 keepers shipped (-8.8% speed, -58% stddev), 1 quality fix (test helpers excluded from coverage). Idea backlog updated.","session_summary":"Cold UT baseline 4.30s -> 3.92s (low load), 4.55s min under load 8. Coverage stable at 98.05/92.20/98.31/98.97."}}
{"run":71,"commit":"7dd0ee3","metric":4.91,"metrics":{"coverage_branches":92.2,"coverage_funcs":98.31,"coverage_lines":98.97,"coverage_stmts":98.05,"file_count":211,"test_count":3659,"ut_max_s":5.02,"ut_min_s":4.6,"ut_stddev_s":0.178},"status":"discard","description":"maxThreads=20 (oversubscribe) — slower, contention","timestamp":1776725728350,"segment":4,"confidence":1.041095890410958,"iterationTokens":8366,"asi":{"hypothesis":"maxThreads=20 minThreads=16 (oversubscribe — 16 cores, 20 workers)","next_action_hint":"Stop oversubscription experiments. Default is best.","rollback_reason":"Oversubscription hurts: 4.91 vs 3.92 baseline. With 16 cores, 20 workers contend on CPU."}}
{"run":72,"commit":"7dd0ee3","metric":8.35,"metrics":{"coverage_branches":92.2,"coverage_funcs":98.31,"coverage_lines":98.97,"coverage_stmts":98.05,"file_count":211,"test_count":3659,"ut_max_s":9.96,"ut_min_s":4.27,"ut_stddev_s":2.395},"status":"discard","description":"Final baseline validation under load 19: min 4.27s","timestamp":1776726097834,"segment":4,"confidence":1,"iterationTokens":2882,"asi":{"hypothesis":"Final baseline validation","min_s_under_load":4.27,"next_action_hint":"Session closed. 3 keepers (-8.8%, stddev -58%), 1 quality fix, ideas backlog updated with 6 future paths.","rollback_reason":"Same code as baseline. min 4.27s consistent with 3.92s low-load best; system load (19.45) inflates median to 8.35s."}}
{"run":73,"commit":"7dd0ee3","metric":4.25,"metrics":{"coverage_branches":92.2,"coverage_funcs":98.31,"coverage_lines":98.97,"coverage_stmts":98.05,"file_count":211,"test_count":3659,"ut_max_s":7.38,"ut_min_s":4.24,"ut_stddev_s":1.478},"status":"discard","description":"Migrate cache.dir to cacheDir (silence deprecation) — within noise, hygiene win","timestamp":1776726166564,"segment":4,"confidence":1.041095890410958,"iterationTokens":4033,"asi":{"hypothesis":"Migrate test.cache.dir → root cacheDir (silences deprecation warning, no behavioral change)","load_avg_at_test":19,"next_action_hint":"Re-apply manually as hygiene commit (silences deprecation, future vitest upgrade safe).","rollback_reason":"Median 4.25 vs best 3.92 — within load noise (min 4.24 matches best), but autoresearch keep requires primary improvement. Reapply as manual hygiene commit."}}
{"run":74,"commit":"1939138","metric":6.79,"metrics":{"coverage_branches":92.2,"coverage_funcs":98.31,"coverage_lines":98.97,"coverage_stmts":98.05,"file_count":211,"test_count":3659,"ut_max_s":11.15,"ut_min_s":4.13,"ut_stddev_s":2.894},"status":"discard","description":"Coverage thresholds 90→95 (stmts/funcs/lines) — locks in user requirement","timestamp":1776726220875,"segment":4,"confidence":1,"iterationTokens":2918,"asi":{"hypothesis":"Raise coverage thresholds to enforce user-requested 95+ floor (statements/functions/lines). Branches stays at 90 (current 92.20 < 95).","next_action_hint":"Commit manually as quality fix.","rollback_reason":"Same primary metric (no speed change) but high load made median 6.79. Quality improvement: future regression below 95% will fail the build. Re-apply manually."}}
{"run":75,"commit":"6ec640f","metric":4.6,"metrics":{"coverage_branches":92.2,"coverage_funcs":98.31,"coverage_lines":98.97,"coverage_stmts":98.05,"file_count":211,"test_count":3659,"ut_max_s":4.9,"ut_min_s":4.44,"ut_stddev_s":0.191},"status":"discard","description":"clearMocks+restoreMocks=true defaults — slower, discard","timestamp":1776726275616,"segment":4,"confidence":0.9999999999999988,"iterationTokens":3075,"asi":{"hypothesis":"clearMocks/restoreMocks: true defaults — reduce per-test boilerplate, ensure clean state","next_action_hint":"Per-test mock reset adds overhead. Tests already have own beforeEach.","rollback_reason":"All tests still pass but median 4.60 vs 3.92 (+17%). The auto reset of every mock per test adds measurable overhead in 3659 tests."}}
{"run":76,"commit":"6ec640f","metric":7.75,"metrics":{"coverage_branches":92.2,"coverage_funcs":98.31,"coverage_lines":98.97,"coverage_stmts":98.05,"file_count":211,"test_count":3659,"ut_max_s":9.29,"ut_min_s":4.26,"ut_stddev_s":2.104},"status":"discard","description":"Re-validation under load 16: min 4.26s consistent","timestamp":1776726577815,"segment":4,"confidence":0.9268292682926823,"iterationTokens":2302,"asi":{"hypothesis":"Re-validation; min stays near baseline under load 16","load_avg":15.68,"min_s_consistent":4.26,"next_action_hint":"Speed work plateaued under load; min consistently 4.13-4.27 across all post-fix runs.","rollback_reason":"Same code; high system load (15) prevents reaching 3.92s low-load best."}}
{"type":"config","name":"UT meaningfulness: branch coverage + de-flake CI-skipped + strengthen assertions","metricName":"coverage_branches","metricUnit":"","bestDirection":"higher"}
{"run":77,"commit":"198bf55","metric":91.62,"metrics":{"ut_median_s":7.96,"ut_min_s":5.19,"ut_max_s":10.95,"ut_stddev_s":2.352,"coverage_stmts":96.93,"coverage_funcs":97.01,"coverage_lines":97.61,"test_count":3698,"file_count":211},"status":"keep","description":"Baseline: branches=91.62, stmts=96.93, funcs=97.01, lines=97.61, 3698 tests","timestamp":1777153129102,"segment":5,"confidence":null,"iterationTokens":247,"asi":{"hypothesis":"Establish baseline for meaningfulness session","load_avg":19,"baseline":true,"next_action_hint":"Identify lowest-branch files; add tests for /api/admin/check, /api/achievements, session-sync.ts edge paths"}}
{"run":78,"commit":"f1c770f","metric":92.16,"metrics":{"coverage_funcs":97.57,"coverage_lines":97.99,"coverage_stmts":97.29,"file_count":211,"test_count":3720,"ut_max_s":8.88,"ut_median_s":7.6,"ut_min_s":4.68,"ut_stddev_s":1.758},"status":"keep","description":"Add 22 tests for 6 untested users RPC handlers (getSlugOnly, getNicknameSlug, checkSharedTeam/Season, getFirstSeen, getPublicBySlugOrId)","timestamp":1777153274069,"segment":5,"confidence":null,"iterationTokens":422,"asi":{"hypothesis":"Add 22 tests covering 6 untested handlers in worker-read/src/rpc/users.ts (getSlugOnly, getNicknameSlug, checkSharedTeam, checkSharedSeason, getFirstSeen, getPublicBySlugOrId)","branches_delta":"+0.54","stmts_delta":"+0.36","funcs_delta":"+0.56","lines_delta":"+0.38","tests_added":22,"next_action_hint":"Continue with rpc/teams.ts (br=62.12) and rpc/organizations.ts (br=67.85) — next-lowest branch coverage"}}
{"run":79,"commit":"111e704","metric":92.57,"metrics":{"coverage_funcs":97.94,"coverage_lines":98.34,"coverage_stmts":97.63,"file_count":211,"test_count":3745,"ut_max_s":4.68,"ut_median_s":4.38,"ut_min_s":4.33,"ut_stddev_s":0.155},"status":"keep","description":"Add 25 tests for teams RPC: listAll, getSeasonRegistrations, schema fallback (getById/getMembers), 400 validation matrix","timestamp":1777153379473,"segment":5,"confidence":2.3170731707316987,"iterationTokens":395,"asi":{"branches_delta":"+0.41","hypothesis":"Add 25 tests for teams RPC: listAll, getSeasonRegistrations, schema-fallback paths in getById/getMembers, plus 400 validation matrix","next_action_hint":"Continue with rpc/organizations.ts (br=67.85), rpc/seasons.ts (br=80.51), rpc/projects.ts (br=90.12)","tests_added":25}}
{"run":80,"commit":"b5fdd7d","metric":92.72,"metrics":{"coverage_funcs":98.22,"coverage_lines":98.5,"coverage_stmts":97.77,"file_count":211,"test_count":3763,"ut_max_s":8.71,"ut_median_s":7.25,"ut_min_s":4.52,"ut_stddev_s":1.737},"status":"keep","description":"Add 18 tests for organizations RPC: listWithCount, getById/BySlug, checkMembership, listMembersAdmin, countMembers, listForUser 400","timestamp":1777153469292,"segment":5,"confidence":3.9285714285713924,"iterationTokens":394,"asi":{"branches_delta":"+0.15","hypothesis":"Add 18 tests for orgs RPC: listWithCount, getById/BySlug, checkMembership, listMembersAdmin, countMembers, listForUser 400","next_action_hint":"Continue with seasons.ts (br=80.51)","tests_added":18}}
{"run":81,"commit":"49c39f2","metric":92.94,"metrics":{"coverage_funcs":98.5,"coverage_lines":98.63,"coverage_stmts":97.91,"file_count":211,"test_count":3774,"ut_max_s":8.88,"ut_median_s":7.8,"ut_min_s":7.42,"ut_stddev_s":0.618},"status":"keep","description":"Add 11 tests for seasons RPC: aggregateTeamTokens & aggregateMemberTokens (success + 400 matrix + bind-arg verification)","timestamp":1777153595100,"segment":5,"confidence":3.5675675675675054,"iterationTokens":400,"asi":{"branches_delta":"+0.22","hypothesis":"Add 11 tests for seasons RPC: aggregateTeamTokens, aggregateMemberTokens with full 400 validation matrix and bind-arg verification","next_action_hint":"Continue with showcases/projects/users/leaderboard for further branch gains; then look at non-RPC web routes","tests_added":11}}
{"run":82,"commit":"3bca83b","metric":93.05,"metrics":{"coverage_funcs":98.5,"coverage_lines":98.72,"coverage_stmts":97.99,"file_count":212,"test_count":3792,"ut_max_s":7.65,"ut_median_s":4.72,"ut_min_s":4.08,"ut_stddev_s":1.554},"status":"keep","description":"Export & test session-sync helpers (toQueueRecord, sourceKey): cover projectRef hash-fallback + all Source enum cases + exhaustiveness throw","timestamp":1777153780883,"segment":5,"confidence":4.085714285714248,"iterationTokens":401,"asi":{"branches_delta":"+0.11","extracted_helpers":["toQueueRecord","sourceKey"],"hypothesis":"Export session-sync helpers (toQueueRecord, sourceKey) for direct unit testing of defensive branches: projectRef hash-fallback, all Source enum mappings, exhaustiveness throw","next_action_hint":"session-sync.ts branches still 71% — remaining lines are in executeSessionSync orchestration path. Move on to status.ts and copilot-cli-session.ts.","tests_added":18}}
{"run":83,"commit":"cd8d60a","metric":93.05,"metrics":{"coverage_funcs":98.5,"coverage_lines":98.72,"coverage_stmts":97.99,"file_count":212,"test_count":3792,"ut_max_s":9.01,"ut_median_s":7.84,"ut_min_s":4.5,"ut_stddev_s":1.911},"status":"keep","description":"Strengthen 22 weak toBeDefined() assertions in achievements API tests to type+domain checks (category/tier enum, progress \\u2208[0,1], tiers monotonic, summary invariants)","timestamp":1777154057720,"segment":5,"confidence":4.333333333333333,"iterationTokens":1808,"asi":{"hypothesis":"Strengthen weak toBeDefined() assertions in achievements-api.test.ts and user-achievements-api.test.ts to type+domain checks (category enum, tier enum, progress ∈[0,1], tiers strictly increasing, summary numeric invariants). Pure meaningfulness improvement — doesn't move branch coverage but turns previously-vacuous existence checks into actual contract assertions.","meaningfulness":"Tests now catch e.g. accidentally returning a category not in the enum, a tier value outside the valid set, progress > 1, non-monotonic tiers, diamondCount > totalUnlocked. Previous toBeDefined() would have silently passed.","next_action_hint":"Could continue similarly in coordinator.test.ts (10), navigation.test.ts (10), achievements-privacy.test.ts (9). Or move on to fixing CI-skipped tests.","primary_unchanged_intentional":true,"weak_assertions_strengthened":22}}
{"run":84,"commit":"cd8d60a","metric":93.14,"metrics":{"ut_median_s":9.73,"ut_min_s":8.9,"ut_max_s":9.91,"ut_stddev_s":0.44,"coverage_stmts":98.07,"coverage_funcs":98.5,"coverage_lines":98.81,"test_count":3807,"file_count":213},"status":"keep","description":"Add tests for organizations/mine (admin path + 401) and auth/invite-required (6 cases) — branches 93.05→93.14","timestamp":1777154452976,"segment":5,"confidence":6.333333333333265,"iterationTokens":904,"asi":{"hypothesis":"Two route files with low absolute uncovered branches: organizations/mine (admin path + 401) and auth/invite-required (had no test file). Adding tests directly hits the missing conditional branches.","branches_delta":"+0.09","tests_added":9,"next_action_hint":"Continue tackling routes with high absolute uncovered branches: achievements/route.ts (24), vscode-copilot.ts (18), sync.ts (18), claude-hook.ts (12), leaderboard.ts (10)."}}
{"run":85,"commit":"cd8d60a","metric":93.41,"metrics":{"coverage_funcs":98.5,"coverage_lines":98.81,"coverage_stmts":98.07,"file_count":213,"test_count":3811,"ut_max_s":4.89,"ut_median_s":4.19,"ut_min_s":4.18,"ut_stddev_s":0.332},"status":"keep","description":"Add 4 tests covering null-aggregates / zero-input / cached-cost paths in /api/achievements — branches 93.14→93.41","timestamp":1777154603031,"segment":5,"confidence":8.136363636363642,"iterationTokens":1224,"asi":{"branches_delta":"+0.27","hypothesis":"Add 4 tests covering null aggregates path in /api/achievements (exercises ~20 `usageAgg?.X ?? 0` branches), zero-input cache-master divide-by-zero branch, cached-token cost path (cachedTokens && pricing.cached truthy), and non-Error rejection.","next_action_hint":"Continue with vscode-copilot.ts (18), sync.ts (18), claude-hook.ts (12), leaderboard.ts (10)."}}
{"run":86,"commit":"cd8d60a","metric":93.58,"metrics":{"coverage_funcs":98.5,"coverage_lines":98.81,"coverage_stmts":98.15,"file_count":213,"test_count":3813,"ut_max_s":4.98,"ut_median_s":4.62,"ut_min_s":4.48,"ut_stddev_s":0.211},"status":"keep","description":"Add defensive-branch tests for vscode-copilot parser (invalid CRDT shapes + already-processed index) — branches 93.41→93.58","timestamp":1777154776049,"segment":5,"confidence":5.681159420289855,"iterationTokens":404,"asi":{"branches_delta":"+0.17","hypothesis":"Add 2 tests covering vscode-copilot.ts defensive branches: (1) invalid kind=0/2/1 line shapes (no v, non-array requests, non-object entries, k.length mismatch, k[0] mismatch, negative/non-finite/string-numeric indices, empty modelId, NaN timestamp, non-string modelId), and (2) already-processed-index early-continue. Hits ~14 of 18 uncovered branches.","next_action_hint":"Continue with sync.ts (18 missing), claude-hook.ts (12), worker-read leaderboard.ts (10), admin/showcases route (8).","tests_added":2}}
{"run":87,"commit":"3abfdf8","metric":93.75,"metrics":{"coverage_funcs":98.69,"coverage_lines":98.94,"coverage_stmts":98.28,"file_count":213,"test_count":3822,"ut_max_s":8.42,"ut_median_s":6.88,"ut_min_s":4.24,"ut_stddev_s":1.726},"status":"keep","description":"Add 9 tests for leaderboard RPC: getUserTeams (untested), schema-fallback rethrow paths, non-Error throwables — branches 93.58→93.75","timestamp":1777154942581,"segment":5,"confidence":5.916666666666663,"iterationTokens":401,"asi":{"branches_delta":"+0.17","hypothesis":"Add 9 tests for worker-read leaderboard RPC: schema-fallback non-Error/non-schema rethrow, getUserTeams handler (4 cases), getUserSessionStats non-schema/non-Error rethrow, table-not-found 'no such table' fallback.","next_action_hint":"Continue with claude-hook.ts (12), admin/showcases route.ts (8), admin/seasons/[seasonId]/route.ts (8).","tests_added":9}}
{"run":88,"commit":"3abfdf8","metric":93.9,"metrics":{"coverage_funcs":98.69,"coverage_lines":98.95,"coverage_stmts":98.34,"file_count":213,"test_count":3826,"ut_max_s":8.98,"ut_median_s":4.66,"ut_min_s":4.66,"ut_stddev_s":2.036},"status":"keep","description":"Add 4 tests for claude-hook (top-level array, non-object hook entries, non-array hooks, no-slash mkdir fallback) — branches 93.75→93.90","timestamp":1777155081133,"segment":5,"confidence":5.428571428571409,"iterationTokens":400,"asi":{"branches_delta":"+0.15","hypothesis":"Add 4 tests for claude-hook.ts: top-level array invalid JSON, non-object hook entries (covers !hook||typeof!=='object' guards in normalizeEntry/stripCommand/hasCommand), non-array hooks early return, no-slash settingsPath fallback (covers lastSlash >= 0 ? ... : '.' branch).","next_action_hint":"Continue with admin/showcases/route.ts (8), admin/seasons/[seasonId]/route.ts (8), parsers/copilot-cli-session.ts (6), parsers/claude-session.ts (7).","tests_added":4}}
{"run":89,"commit":"688a384","metric":94.14,"metrics":{"coverage_funcs":98.69,"coverage_lines":99,"coverage_stmts":98.38,"file_count":213,"test_count":3832,"ut_max_s":8.27,"ut_median_s":6.89,"ut_min_s":4.26,"ut_stddev_s":1.663},"status":"keep","description":"Add 6 tests for admin/showcases (null defaults) + admin/seasons (flag-false branches, non-Error throw) — branches 93.90→94.14","timestamp":1777155229912,"segment":5,"confidence":5.2499999999999485,"iterationTokens":476,"asi":{"branches_delta":"+0.24","hypothesis":"Add 6 tests for admin/showcases (null defaults for stars/forks/topics, null count rows, non-Error rejection) and admin/seasons/[seasonId] (allow_late_registration/allow_late_withdrawal flags including false branch, allow_roster_changes=false branch, non-Error rejection).","next_action_hint":"Continue with parsers/copilot-cli-session.ts (6), parsers/claude-session.ts (7), parsers/opencode-sqlite-session.ts (6), commands/uninstall.ts (6), api/usage/route.ts (4).","tests_added":6}}
{"run":90,"commit":"7ae0408","metric":94.2,"metrics":{"coverage_funcs":98.69,"coverage_lines":99,"coverage_stmts":98.38,"file_count":213,"test_count":3836,"ut_max_s":4.24,"ut_median_s":4.12,"ut_min_s":4.08,"ut_stddev_s":0.068},"status":"keep","description":"Add 4 tests for usage-helpers default-argument paths and zero-day-total dominantShare — branches 94.14→94.20","timestamp":1777155393106,"segment":5,"confidence":5.10891089108908,"iterationTokens":398,"asi":{"branches_delta":"+0.06","hypothesis":"Add 4 tests for usage-helpers default-argument and edge branches: January MoMGrowth (prevYear-1, prevMonth=11), computeWoWGrowth default `now`, computeStreak default `today`, dominantShare=0 when dayTotal=0.","next_action_hint":"Continue with notifier/openclaw-hook.ts (9), api/showcases/route.ts (9), parsers/claude-session.ts (7), parsers/copilot-cli-session.ts (6), api/projects/route.ts (7).","tests_added":4}}
{"run":91,"commit":"1c22404","metric":94.34,"metrics":{"coverage_funcs":98.69,"coverage_lines":99,"coverage_stmts":98.39,"file_count":213,"test_count":3840,"ut_max_s":4.79,"ut_median_s":4.41,"ut_min_s":4.35,"ut_stddev_s":0.195},"status":"keep","description":"Add 4 tests for showcases route (null columns, non-Error rejection) + claude-session (non-string coercion, empty-timestamp sessions) — branches 94.20→94.34","timestamp":1777155571940,"segment":5,"confidence":4.771929824561339,"iterationTokens":396,"asi":{"branches_delta":"+0.14","hypothesis":"Add 4 tests: api/showcases nullable column defaults + non-Error rejection (3 fields), claude-session non-string timestamp/type coercion + sessions with no valid timestamps dropped.","next_action_hint":"Continue with parsers/copilot-cli-session.ts (6), parsers/opencode-sqlite-session.ts (6), worker-read/rpc/projects.ts (8), api/projects/route.ts (7), api/admin/organizations/[orgId]/route.ts (6).","tests_added":4}}
{"run":92,"commit":"f54305a","metric":94.51,"metrics":{"coverage_funcs":98.69,"coverage_lines":99.07,"coverage_stmts":98.47,"file_count":213,"test_count":3848,"ut_max_s":4.34,"ut_median_s":4.23,"ut_min_s":4.2,"ut_stddev_s":0.06},"status":"keep","description":"Add 8 tests: projects RPC 400-validation matrix + copilot-cli-session edge cases — branches 94.34→94.51","timestamp":1777155722515,"segment":5,"confidence":4.8983050847457354,"iterationTokens":394,"asi":{"branches_delta":"+0.17","hypothesis":"Add 8 tests: 6× projects RPC 400-validation matrix (getAliasOwner, aliasAttachedToProject, tagExists, getTagList, getByNameExcluding, existsForUser) + 2× copilot-cli-session edge cases (no-timestamp request line, multiple-timestamp lines).","next_action_hint":"Continue with worker-read showcases.ts (6), worker-read usage.ts (6), api/admin/organizations/[orgId]/route.ts (6), api/seasons/[seasonId]/leaderboard/route.ts (6), api/devices/route.ts (6), commands/uninstall.ts (6), api/settings/route.ts (6), notifier/gemini-hook.ts (7).","tests_added":8}}
